,Object Number,Object ID,Department,Object Name,Title,Object Begin Date,Object End Date,Medium,Link Resource
0,62.16,1674,American Decorative Arts,Side Chair,Side Chair,1794,1799.0,"Mahogany, ebony, ash, birch, white pine",http://www.metmuseum.org/art/collection/search/1674
1,13.7.17,2430,American Decorative Arts,Pitcher,Covered Pitcher,1700,1900.0,Earthenware,http://www.metmuseum.org/art/collection/search/2430
2,33.85.11,6406,American Decorative Arts,Plate,Plate,1740,1760.0,Earthenware,http://www.metmuseum.org/art/collection/search/6406
3,69.194.109,7616,American Decorative Arts,Soup bowl,Soup Bowl,1885,1885.0,Porcelain,http://www.metmuseum.org/art/collection/search/7616
4,2006.235.20,15012,American Decorative Arts,"Painting, miniature",Portrait of a Lady,1840,1840.0,Watercolor on ivory,http://www.metmuseum.org/art/collection/search/15012
5,32.75.439,23510,Arms and Armor,Arrowhead (Yanonē),Arrowhead (Yanonē),1701,1800.0,Steel,http://www.metmuseum.org/art/collection/search/23510
6,36.120.286,29920,Arms and Armor,Knife handle (Kozuka),Knife Handle (Kozuka),1770,1852.0,"Copper-gold alloy (shakudō), copper-silver alloy (shibuichi), gold",http://www.metmuseum.org/art/collection/search/29920
7,23.135.3,32848,Arms and Armor,Coin (Thaler),Coin (Thaler) Showing August I (The Pious) of Saxony,1580,1580.0,Silver,http://www.metmuseum.org/art/collection/search/32848
8,"29.158.740a, b",34014,Arms and Armor,Two drawings,Drawings Showing Combat on Foot (Champ Clos),1501,1600.0,"Pen, ink and watercolor on paper",http://www.metmuseum.org/art/collection/search/34014
9,29.156.26,34308,Arms and Armor,Partisan,Partisan,1701,1800.0,"Steel, wood, textile, metallic thread",http://www.metmuseum.org/art/collection/search/34308
10,29.100.1067,34477,Arms and Armor,Sword guard (Tsuba),Sword Guard (Tsuba),1590,1900.0,"Iron, gold, silver, copper",http://www.metmuseum.org/art/collection/search/34477
11,"91.16.91a, b",35163,Arms and Armor,Dirk with sheath,Dirk with Sheath,1800,1850.0,"Steel, horn, brass, leather, copper wire",http://www.metmuseum.org/art/collection/search/35163
21,2005.509.32,72803,Asian Art,Hanging scroll,近代  蟬竹圖      軸|Bamboo and Cicada,1966,1966.0,Hanging scroll; ink and color on paper,http://www.metmuseum.org/art/collection/search/72803
23,1993.154.1,80735,Costume Institute,Belt,Belt,1983,1987.0,"leather, metal",http://www.metmuseum.org/art/collection/search/80735
24,"1999.248.25a, b",81291,Costume Institute,Pumps,Pumps,1980,1989.0,leather,http://www.metmuseum.org/art/collection/search/81291
25,"1998.508.60a, b",81451,Costume Institute,Evening dress,Evening dress,1983,1984.0,rayon,http://www.metmuseum.org/art/collection/search/81451
26,"2002.199.10a, b",83780,Costume Institute,Shoes,Shoes,1983,1989.0,synthetic,http://www.metmuseum.org/art/collection/search/83780
27,"09.37.2a, b",90373,Costume Institute,Earrings,Earrings,1700,1899.0,metal,http://www.metmuseum.org/art/collection/search/90373
28,1975.145.6,96100,Costume Institute,Evening dress,Evening dress,1966,1967.0,[no medium available],http://www.metmuseum.org/art/collection/search/96100
29,X.278,98251,Costume Institute,Cap,Cap,1800,1899.0,wool,http://www.metmuseum.org/art/collection/search/98251
30,1981.151.23,100359,Costume Institute,Hat,Hat,1949,1949.0,"wool, cotton",http://www.metmuseum.org/art/collection/search/100359
32,"1977.287.19a, b",114490,Costume Institute,Mules,Mules,1959,1959.0,"leather, wood, metal glass",http://www.metmuseum.org/art/collection/search/114490
33,"1980.185.7a, b",119757,Costume Institute,Gloves,Gloves,1950,1959.0,leather,http://www.metmuseum.org/art/collection/search/119757
34,C.I.39.91.1a–d,127104,Costume Institute,Ensemble,Ensemble,1800,1939.0,"linen, wool",http://www.metmuseum.org/art/collection/search/127104
35,"2006.253.17a, b",129839,Costume Institute,Ensemble,Ensemble,1976,1980.0,"a) leather; b) leather, metal",http://www.metmuseum.org/art/collection/search/129839
36,2017.113.336,145237,Costume Institute,Necklace,Necklace,1967,1967.0,"synthetic, metal",http://www.metmuseum.org/art/collection/search/145237
37,2008.311,146150,Costume Institute,Jacket,Jacket,2003,2004.0,"leather, wool",http://www.metmuseum.org/art/collection/search/146150
38,2009.300.4351,168579,Costume Institute,Chemisette,Chemisette,1875,1899.0,Cotton,http://www.metmuseum.org/art/collection/search/168579
39,2009.300.4588,168781,Costume Institute,Fan,Fan,1776,1799.0,"Ivory, paper",http://www.metmuseum.org/art/collection/search/168781
40,"2009.300.5715a, b",169926,Costume Institute,Undersleeves,Undersleeves,1848,1852.0,Linen,http://www.metmuseum.org/art/collection/search/169926
41,"2009.300.5836a, b",170041,Costume Institute,Evening shoes,Evening shoes,1938,1943.0,"Leather, metallic",http://www.metmuseum.org/art/collection/search/170041
42,"2009.300.7375a, b",174460,Costume Institute,Ensemble,Ensemble,1950,1950.0,Wool,http://www.metmuseum.org/art/collection/search/174460
43,93.13.85–.87,187639,European Sculpture and Decorative Arts,Knife and fork with case,Knife and fork with case,1700,1750.0,"Steel, silver, niello; case:  leather, silver, niello",http://www.metmuseum.org/art/collection/search/187639
44,07.225.510.461a–e,190199,European Sculpture and Decorative Arts,Swags,Set of five swags,1700,1799.0,Gilt bronze,http://www.metmuseum.org/art/collection/search/190199
45,"20.62.1a, b",194582,European Sculpture and Decorative Arts,Jug with cover,Jug with cover,1755,1765.0,Stoneware,http://www.metmuseum.org/art/collection/search/194582
46,39.78,198408,European Sculpture and Decorative Arts,Plaque,Marriage of Peleus and Thetis,1570,1580.0,Bronze,http://www.metmuseum.org/art/collection/search/198408
47,48.187.422,200381,European Sculpture and Decorative Arts,Snuffbox,Snuffbox,1770,1780.0,Gold,http://www.metmuseum.org/art/collection/search/200381
48,"53.71.38a–p, aa–pp, r",201480,European Sculpture and Decorative Arts,Chess set,Chess set,1800,1899.0,Metal,http://www.metmuseum.org/art/collection/search/201480
49,"64.101.684a, b",203525,European Sculpture and Decorative Arts,Toy,Partridges in wheatsheaf,1750,1760.0,Soft-paste porcelain,http://www.metmuseum.org/art/collection/search/203525
50,07.23.108,211642,European Sculpture and Decorative Arts,Souvenir spoon,Souvenir spoon,1885,1899.0,Gilt and enamel,http://www.metmuseum.org/art/collection/search/211642
51,09.68.145,218086,European Sculpture and Decorative Arts,Border,Border,1600,1699.0,Needle lace,http://www.metmuseum.org/art/collection/search/218086
52,09.68.395,218343,European Sculpture and Decorative Arts,Fragment,Fragment,1800,1815.0,Machine net,http://www.metmuseum.org/art/collection/search/218343
53,36.130.37,226057,European Sculpture and Decorative Arts,Borders,Borders,1700,1815.0,Needle lace,http://www.metmuseum.org/art/collection/search/226057
54,1976.290.2,229526,European Sculpture and Decorative Arts,Panel,Panel,1775,1780.0,Silk,http://www.metmuseum.org/art/collection/search/229526
55,2009.286,236638,European Sculpture and Decorative Arts,Plaque,Head described as that of Saint James the Elder,1800,1899.0,Iron,http://www.metmuseum.org/art/collection/search/236638
56,74.51.1592,241148,Greek and Roman Art,Statuette of a seated goddess,Terracotta statuette of a seated goddess,-325,-275.0,Terracotta,http://www.metmuseum.org/art/collection/search/241148
57,74.51.5392,244271,Greek and Roman Art,Axehead,Axehead,-3200,-2000.0,Bronze,http://www.metmuseum.org/art/collection/search/244271
58,96.9.313,246324,Greek and Roman Art,"Fibula, boat-shaped type","Fibula, boat-shaped type",-800,-501.0,Bronze,http://www.metmuseum.org/art/collection/search/246324
59,19.45.3,250722,Greek and Roman Art,"Statuette of a woman, seated",Terracotta statuette of a seated woman,-524,-475.0,Terracotta,http://www.metmuseum.org/art/collection/search/250722
60,26.31.223,252173,Greek and Roman Art,Seal,Jasper amygdaloid seal,-1600,-1450.0,Jasper,http://www.metmuseum.org/art/collection/search/252173
61,26.31.271,252221,Greek and Roman Art,Seal,Seal,-2000,-1450.0,Haemaetite,http://www.metmuseum.org/art/collection/search/252221
62,1981.1131.1,262991,Photographs,Photograph,[Detail of Vanitas Figures Carved on the Choir Stalls at Amiens Cathedral],1860,1869.0,Albumen silver print from glass negative,http://www.metmuseum.org/art/collection/search/262991
63,1983.1002.6,263514,Photographs,Photograph,Robert Motherwell,1981,1981.0,Gelatin silver print,http://www.metmuseum.org/art/collection/search/263514
64,1987.1183.3,265758,Photographs,Photograph,[Graffiti on Backstage Door of the School of American Ballet],1945,1945.0,Gelatin silver print,http://www.metmuseum.org/art/collection/search/265758
65,1989.1143,266167,Photographs,Photograph,[Study of Australian Grapes],1858,1862.0,Albumen silver print from glass negative,http://www.metmuseum.org/art/collection/search/266167
66,54.549.66,269735,Photographs,Photograph,Sous bois,1922,1922.0,Bromoil print,http://www.metmuseum.org/art/collection/search/269735
67,47.62.3,271904,Photographs,Glass positive,Margaret Eakins,1880,1889.0,Glass positive ,http://www.metmuseum.org/art/collection/search/271904
68,1994.254.26,273592,Photographs,Negative,[Peggy Bacon],1934,1934.0,Film negative,http://www.metmuseum.org/art/collection/search/273592
69,1994.253.166,276937,Photographs,Negative,"[Two 35mm Film Frames: Boys Playing on Stoop Near Elevated Train Tracks, New York City]",1933,1934.0,Film negative,http://www.metmuseum.org/art/collection/search/276937
70,2005.100.516,286197,Photographs,Photograph,"Rouen, Place Eau-de-Robec",1908,1908.0,Matte albumen silver print from glass negative,http://www.metmuseum.org/art/collection/search/286197
71,1978.412.1023,311479,"Arts of Africa, Oceania, and the Americas",Horn,Horn,1900,2000.0,Bamboo,http://www.metmuseum.org/art/collection/search/311479
72,1979.206.477,312687,"Arts of Africa, Oceania, and the Americas",Snake figure,Coiled Serpent,1400,1600.0,"Stone, pigment",http://www.metmuseum.org/art/collection/search/312687
73,1979.206.842,313019,"Arts of Africa, Oceania, and the Americas",Pendant,Figure Pendant,300,800.0,Jadeite,http://www.metmuseum.org/art/collection/search/313019
74,1992.408.5,316760,"Arts of Africa, Oceania, and the Americas",Painting,Painting,1900,2000.0,"Paper, paint",http://www.metmuseum.org/art/collection/search/316760
77,1994.35.276,317135,"Arts of Africa, Oceania, and the Americas",Ritual stone,Stone Pulidor,1200,1600.0,Stone,http://www.metmuseum.org/art/collection/search/317135
78,1999.47.153b,319532,"Arts of Africa, Oceania, and the Americas",Costume element,Ceremonial Costume Element,1850,1950.0,"Cotton, glass beads",http://www.metmuseum.org/art/collection/search/319532
79,38.40.327,323644,Ancient Near Eastern Art,Sherd,Sherd,-3505,-3100.0,"Ceramic, paint",http://www.metmuseum.org/art/collection/search/323644
80,65.64,325714,Ancient Near Eastern Art,Sculpture,Bird standard,-2500,-2500.0,Copper alloy,http://www.metmuseum.org/art/collection/search/325714
81,1985.356.45,327150,Ancient Near Eastern Art,Bead,Bead,-7000,-5000.0,Calcite,http://www.metmuseum.org/art/collection/search/327150
82,41.12.93,339097,Drawings and Prints,Print; Poster,New York Ledger: Bicycle Number,1895,1895.0,Lithograph,http://www.metmuseum.org/art/collection/search/339097
83,64.38.3,339407,Drawings and Prints,Drawing,Figure Studies,1696,1770.0,"Pen and brown ink, over black chalk, on beige paper",http://www.metmuseum.org/art/collection/search/339407
84,27.78.1(406),341146,Drawings and Prints,Print,Reciprocated Love,1584,1600.0,Engraving,http://www.metmuseum.org/art/collection/search/341146
85,26.70.4(66),341485,Drawings and Prints,Print,"Rest on the flight into Egypt, Mary holding and looking at the infant Christ while St. Joseph reads",1632,1642.0,Etching,http://www.metmuseum.org/art/collection/search/341485
86,1987.1141,345964,Drawings and Prints,Book,Meubles Modernes,1875,1890.0,Chromolithography,http://www.metmuseum.org/art/collection/search/345964
87,41.102.4,346186,Drawings and Prints,Book,Blossoms of Childhood,1840,1840.0,Illustrations: wood engraving,http://www.metmuseum.org/art/collection/search/346186
88,64.629.3,347789,Drawings and Prints,Book,"The Comical History of Lord Flutter, Lord Spindle and Sir Harry Hopscotch; or, the Bee, the Wasp, and the Ant",1800,1900.0,"Wood engraving, hand colored",http://www.metmuseum.org/art/collection/search/347789
89,60.609.67,350011,Drawings and Prints,Book,"Seamless Plain Solid Gold Rings, Engraved Rings, Diamond Rings, Mountings, Ladies' Stone Rings, Chains, Diamond Cutters",1902,1902.0,Illustrations: photomechanical process,http://www.metmuseum.org/art/collection/search/350011
90,1986.1110.1,350542,Drawings and Prints,Book,"Performing Tea Ceremony, The Miyako Odori for 1935, and eight stage sets",1930,1940.0,Illustrations: photographic method and color prints,http://www.metmuseum.org/art/collection/search/350542
92,62.688.2,355115,Drawings and Prints,Book,"Exposition Lorraine. L'École de Nancy au Musée de l'Union Centrale des Arts Décoratifs. Pavillon de Marsan, A Paris. Ier Série: Le Moblier",1900,1910.0,Heliotype print,http://www.metmuseum.org/art/collection/search/355115
93,66.542.18,357808,Drawings and Prints,Book,Enoch Arden,1866,1866.0,Illustrations: wood engraving,http://www.metmuseum.org/art/collection/search/357808
94,49.92.13,360463,Drawings and Prints,Drawing,"St. Peter's, exterior, tabernacle, elevation and section at base with details of pedestal and railing, (recto)St. Peter's, exterior, tabernacle, elevation and section at arched opening (verso)",1500,1560.0,"Dark brown ink, black chalk, and incised lines",http://www.metmuseum.org/art/collection/search/360463
95,17.50.18-175,360750,Drawings and Prints,Print,Head of a muscular old man in profile to left with flowing hair,1677,1625.0,Etching; only state,http://www.metmuseum.org/art/collection/search/360750
96,60.591.5,363070,Drawings and Prints,Print,"View of the Basilica of San Sebastiano fuori delle mura [St. Sebastian outside the Walls] on the Appian Way, from Vedute di Roma (Roman Views)",1745,1755.0,Etching; first state of four (Hind),http://www.metmuseum.org/art/collection/search/363070
97,63.712.91,363754,Drawings and Prints,Drawing,Design for Pointed Utensil with an Egyptian Style Figure on the Handle,1548,1612.0,"Pen and brown ink, brush and brown wash, over black chalk.",http://www.metmuseum.org/art/collection/search/363754
98,80.3.286,365646,Drawings and Prints,Drawing,Saint Paul,1591,1666.0,"Pen and brown ink, brush and brown ink, over lead point or graphite.",http://www.metmuseum.org/art/collection/search/365646
99,1972.607.3,367617,Drawings and Prints,Drawing Ornament & Architecture,Francis W. Little House: Furniture Plan,1908,1914.0,Graphite and orange and brown pencil,http://www.metmuseum.org/art/collection/search/367617
100,41.101.2(6),371229,Drawings and Prints,Print,"Theodoric IV from the series Counts and Countesses of Holland, Zeeland, and West-Frisia",1650,1650.0,Engraving and etching; second state of three,http://www.metmuseum.org/art/collection/search/371229
101,52.519.33.2,377953,Drawings and Prints,Book,L'Art de bâtir des maisons de Campagne,1743,1743.0,Printed book with engraved illustrations,http://www.metmuseum.org/art/collection/search/377953
103,23.112.838,378914,Drawings and Prints,Drawing,"Design for Pony Phaeton, no. 3162",1875,1875.0,"Pen and black ink, watercolor and gouache",http://www.metmuseum.org/art/collection/search/378914
104,61.669.18,386510,Drawings and Prints,Drawing ; Ornament and architecture,"Ceiling Design, Half of a Circle",1800,1899.0,Watercolor with gold,http://www.metmuseum.org/art/collection/search/386510
105,29.107.14,391909,Drawings and Prints,Print,Canal with an Angler and Two Swans,1643,1653.0,Etching and drypoint; second of two states,http://www.metmuseum.org/art/collection/search/391909
106,2011.214.1–.9,396269,Drawings and Prints,Print,GERYON,1957,1957.0,"Etching, aquatint and drypoint; states 1-8",http://www.metmuseum.org/art/collection/search/396269
107,2011.305,397577,Drawings and Prints,Print,"Syzygy or the Conjunction of the Macrocosmic Unity with the Microcosmic Triunity from Heinrich Khunrath, Amphiteatrum sapientiae aeternae",1535,1611.0,Engraving from a circular plate,http://www.metmuseum.org/art/collection/search/397577
108,43.47.258,399078,Drawings and Prints,Print,Horse Group #17,1935,1943.0,Lithograph,http://www.metmuseum.org/art/collection/search/399078
109,43.47.344,399085,Drawings and Prints,Print,Whither Mankind,1935,1943.0,Silkscreen,http://www.metmuseum.org/art/collection/search/399085
110,51.501.4223,399877,Drawings and Prints,Print,"The dream of St Joseph, who is sleeping at the right, the Virgin and Child by a cross surrounded by angels and many putti and with God the Father above",1600,1650.0,Etching,http://www.metmuseum.org/art/collection/search/399877
111,63.350.222.284.91,400013,Drawings and Prints,Baseball card,"Sullivan, Left Field, Chicago, from the Gold Coin series (N284) for Gold Coin Chewing Tobacco",1887,1887.0,Commercial color lithography reproducing drawings,http://www.metmuseum.org/art/collection/search/400013
112,2012.136.939,400018,Drawings and Prints,Print,Section and elevation of the Colosseum in Rome,1581,1581.0,Etching,http://www.metmuseum.org/art/collection/search/400018
113,91.1.74,404850,Drawings and Prints,Print,"Chairing the Members, Plate IV: Four Prints of an Election",1758,1758.0,Etching and engraving; third state of three,http://www.metmuseum.org/art/collection/search/404850
114,63.350.201.28.20,410156,Drawings and Prints,Print,"George Bubear, Oarsman, from World's Champions, Series 1 (N28) for Allen & Ginter Cigarettes",1887,1887.0,Commercial color lithograph,http://www.metmuseum.org/art/collection/search/410156
115,"Burdick 325, R327.130",410683,Drawings and Prints,Baseball card,"Louis Chiozza; verso: Diamond Stars, No. 80 (1934 Averages)",1935,1935.0,Commercial color lithograph,http://www.metmuseum.org/art/collection/search/410683
116,51.501.4016,415848,Drawings and Prints,Print,"Prise de la Ville de Bone (Capture of the City of Bonne), from La Vie de Ferdinand Ier de Médicis série appelée aussi Les Batailles des Médicis (The Life of Ferdinand I de'Medici also called The Medici Battles)",1614,1620.0,Engraving; first state of two (Lieure),http://www.metmuseum.org/art/collection/search/415848
117,59.644.71,417951,Drawings and Prints,Print,The Impossibility,1548,1548.0,Engraving,http://www.metmuseum.org/art/collection/search/417951
118,17.50.17-371(236),419823,Drawings and Prints,Print,"S. Antioche, médecin (St. Antiochus, Doctor), July 15th, from Les Images De Tous Les Saincts et Saintes de L'Année (Images of All of the Saints and Religious Events of the Year)",1636,1636.0,Etching; second state of two (Lieure),http://www.metmuseum.org/art/collection/search/419823
119,31.108.4,428594,Drawings and Prints,Print,Sea-Bass Fisherman,1900,1931.0,Etching,http://www.metmuseum.org/art/collection/search/428594
120,24.63.1280,428786,Drawings and Prints,Print,Reverse Copy of Madame Bouthillier (Marie de Bragelogne),1810,1820.0,Engraving,http://www.metmuseum.org/art/collection/search/428786
121,"Burdick 314, E42.2",430474,Drawings and Prints,Print,"Reconnoitering, from the Boy Scouts series (E42) for the Fisher Candy Co.",1910,1910.0,Commercial color lithograph,http://www.metmuseum.org/art/collection/search/430474
122,51.553.2(13),431102,Drawings and Prints,Print,Vues de St. Petersbourg,1840,1840.0,"Lithography, hand-colored",http://www.metmuseum.org/art/collection/search/431102
123,63.350.246.212.127,433636,Drawings and Prints,"Baseball card, print","Fitzgerald, Sacramento, Pacific Coast League, from the ""Obak Baseball Players"" set (T212), issued by the American Tobacco Company to promote Obak Mouthpiece Cigarettes",1910,1910.0,Commercial color lithograph,http://www.metmuseum.org/art/collection/search/433636
124,63.350.246.204.83,434286,Drawings and Prints,"Baseball card, print","Spencer, Catcher, Boston, American League, from the Baseball Players (Ramlys) series (T204) issued by the Mentor Company to promote Ramly and T.T.T. Turkish Cigarettes",1909,1909.0,Photolithograph,http://www.metmuseum.org/art/collection/search/434286
125,13.190.4,446304,Islamic Art,Fragment,Fragment of a Bowl,1300,1499.0,Earthenware; incised decoration through a white slip and coloring under a transparent glaze.,http://www.metmuseum.org/art/collection/search/446304
126,26.238.2,447944,Islamic Art,Fragment,Fragment,1700,1799.0,Cotton; painted,http://www.metmuseum.org/art/collection/search/447944
127,37.40.43,449151,Islamic Art,Dado panel,Dado Panel,1900,1999.0,Plaster; cast,http://www.metmuseum.org/art/collection/search/449151
128,1974.294.4,452672,Islamic Art,Folio from an illustrated manuscript,"""Yusuf and Zulaikha"", Folio 51r from a Bustan of Sa`di",1500,1560.0,"Ink, opaque watercolor, and gold on paper",http://www.metmuseum.org/art/collection/search/452672
129,1975.1.420,459471,Robert Lehman Collection,Drawing,Head of a Man in Profile,1490,1499.0,"Black chalk, pen and brown ink, heightened with white.",http://www.metmuseum.org/art/collection/search/459471
130,23.229.5-5,466522,Medieval Art,Fragment,Glass Fragment,1200,1299.0,Colorless glass,http://www.metmuseum.org/art/collection/search/466522
131,63.185.2,468605,Medieval Art,Hilt,Eagle-Headed Hilt,300,400.0,Copper alloy,http://www.metmuseum.org/art/collection/search/468605
132,1982.433.1,469993,The Cloisters,Panel,Grisaille Panel,1250,1270.0,White and pot-metal glass with vitreous paint,http://www.metmuseum.org/art/collection/search/469993
133,25.120.637,470842,The Cloisters,Capital,Capital,1100,1150.0,Marble,http://www.metmuseum.org/art/collection/search/470842
134,32.24.27,471090,The Cloisters,Roundel,Roundel with Saint John the Baptist,1510,1520.0,"Colorless glass, silver stain, vitreous paint",http://www.metmuseum.org/art/collection/search/471090
135,1983.607.86,482952,Modern and Contemporary Art,Drawing,Untitled,1940,1940.0,Graphite on paper,http://www.metmuseum.org/art/collection/search/482952
136,1988.31.12,485091,Modern and Contemporary Art,Glass,Glass,1950,1959.0,Glass,http://www.metmuseum.org/art/collection/search/485091
137,1994.322,486390,Modern and Contemporary Art,Design,"Design for a Washstand for the Blue Bedroom, Hous'hill",1904,1904.0,Watercolor and graphite on paper,http://www.metmuseum.org/art/collection/search/486390
138,1995.243,486599,Modern and Contemporary Art,Bowl,"""Tard la Nuit"" Bowl",1989,1989.0,Glass,http://www.metmuseum.org/art/collection/search/486599
140,49.70.207,488438,Modern and Contemporary Art,Drawing,Alvin Langdon Coburn,1910,1910.0,"Ink, watercolor, metallic paint, and graphite on paper",http://www.metmuseum.org/art/collection/search/488438
141,17.6.74,544812,Egyptian Art,"Figurine, female, fragmentary",Upper Half of a Female Figurine,-1981,-1981.0,Pottery,http://www.metmuseum.org/art/collection/search/544812
142,09.184.699,545193,Egyptian Art,"Ostracon, hieratic",Hieratic ostracon,-1295,-1295.0,"Limestone, ink, paint",http://www.metmuseum.org/art/collection/search/545193
143,07.228.71,547202,Egyptian Art,"Figurine, seated woman",Figurine of a Seated Woman,-3450,-3300.0,"Limestone, organic material, paint, malachite",http://www.metmuseum.org/art/collection/search/547202
144,07.228.110,547248,Egyptian Art,"Beaker, white cross-lined ware",White cross-lined ware beaker decorated with zigzags,-3900,-3650.0,"Pottery, paint",http://www.metmuseum.org/art/collection/search/547248
145,36.3.205,549075,Egyptian Art,Club,Club,-1473,-1458.0,Wood,http://www.metmuseum.org/art/collection/search/549075
146,"31.3.51a, b",556721,Egyptian Art,"Basket, coil, lid",Cylindrical Coil Basket with Lid,-2124,-2124.0,Grasses,http://www.metmuseum.org/art/collection/search/556721
147,17.10.324,563318,Egyptian Art,Jar Label,Jar label fragments,-1390,-1390.0,"Pottery and ink, paint",http://www.metmuseum.org/art/collection/search/563318
149,17.10.898,563892,Egyptian Art,"Jar Label, meat",Jar Label,-1390,-1390.0,"Pottery and ink, paint",http://www.metmuseum.org/art/collection/search/563892
150,33.1.185g,564519,Egyptian Art,Relief fragment,Relief fragment,-1981,-1640.0,Granite,http://www.metmuseum.org/art/collection/search/564519
151,20.3.203qqqq,565027,Egyptian Art,"Linen, from Wah's Mummy","Linen, from Wah's Mummy",-1981,-1975.0,Linen,http://www.metmuseum.org/art/collection/search/565027
152,1973.565.2,623826,Drawings and Prints,Print,Discover Dry Dock Country: Madison Avenue between 63rd and 65th,1972,1972.0,Commercial printing in color,http://www.metmuseum.org/art/collection/search/623826
153,35.85.19,625312,Drawings and Prints,Print,"St. Agatha, from 'Di Tutti gli Affresco del Correggio e di Quattro del Parmigianino'",1841,1851.0,Engraving,http://www.metmuseum.org/art/collection/search/625312
154,"Burdick 324, R311.38",632372,Drawings and Prints,Photograph,"Walter Switzer, Cornell Quarterback shown being grounded by three Columbia Players, from the ""Baseball and Football"" set (R311), issued by the National Chicle Company to promote Diamond Stars Gum",1936,1936.0,Albumen print (glossy finish),http://www.metmuseum.org/art/collection/search/632372
155,22.73.3-78,634357,Drawings and Prints,Print,"The Virgin and Child with St. John the Baptist, St. Francis, and St. Catherine of Siena",1585,1585.0,Chiaroscuro woodcut from four blocks printed in orange,http://www.metmuseum.org/art/collection/search/634357
156,"Burdick 328, R414-5.81",634643,Drawings and Prints,"Print, baseball card","Card Number 28, Harry ""The Cat"" Brecheen, Pitcher, St. Louis Cardinals, from the Topps Red/ Blue Backs series (R414-5) issued by Topps Chewing Gum Company",1951,1951.0,Commercial color lithograph,http://www.metmuseum.org/art/collection/search/634643
157,"Burdick 339, V401.145",638012,Drawings and Prints,Print,"Card No. 145, U.S. Luscombe ""Silvaire,"" from the Aviation Gum series (V356), issued by World Wide Gum Company, Ltd.",1940,1940.0,Photolithograph,http://www.metmuseum.org/art/collection/search/638012
